Date,Symbol,Client_Name,Buy_Sell,Quantity,Price,Source
2025-09-09,HCLTECH,KAPITALFORENINGEN INVESTIN PRO,BUY,,,Block-Deals-03-11-2024-to-03-11-2025.csv
2025-09-09,HCLTECH,KAPITALFORENINGEN PENSAM INVEST,SELL,,,Block-Deals-03-11-2024-to-03-11-2025.csv
2025-09-09,HINDALCO,KAPITALFORENINGEN INVESTIN PRO,BUY,,,Block-Deals-03-11-2024-to-03-11-2025.csv
2025-09-09,HINDALCO,KAPITALFORENINGEN PENSAM INVEST,SELL,,,Block-Deals-03-11-2024-to-03-11-2025.csv
2025-09-09,ICICIBANK,KAPITALFORENINGEN INVESTIN PRO,BUY,,,Block-Deals-03-11-2024-to-03-11-2025.csv
2025-09-09,ICICIBANK,KAPITALFORENINGEN PENSAM INVEST,SELL,,,Block-Deals-03-11-2024-to-03-11-2025.csv
2025-09-09,INFY,GOLDMAN SACHS (SINGAPORE) PTE - ODI,SELL,,,Block-Deals-03-11-2024-to-03-11-2025.csv
2025-09-09,INFY,GOLDMAN SACHS BANK EUROPE SE - ODI,BUY,,,Block-Deals-03-11-2024-to-03-11-2025.csv
2025-09-09,INFY,KAPITALFORENINGEN INVESTIN PRO,BUY,,,Block-Deals-03-11-2024-to-03-11-2025.csv
2025-09-09,INFY,KAPITALFORENINGEN PENSAM INVEST,SELL,,,Block-Deals-03-11-2024-to-03-11-2025.csv
2025-09-09,LEMONTREE,GOLDMAN SACHS (SINGAPORE) PTE - ODI,SELL,,,Block-Deals-03-11-2024-to-03-11-2025.csv
2025-09-09,LEMONTREE,GOLDMAN SACHS BANK EUROPE SE- ODI,BUY,,,Block-Deals-03-11-2024-to-03-11-2025.csv
2025-09-09,PAYTM,GOLDMAN SACHS (SINGAPORE) PTE - ODI,SELL,,,Block-Deals-03-11-2024-to-03-11-2025.csv
2025-09-09,PAYTM,GOLDMAN SACHS BANK EUROPE SE- ODI,BUY,,,Block-Deals-03-11-2024-to-03-11-2025.csv
2025-09-09,PFC,GOLDMAN SACHS (SINGAPORE) PTE - ODI,SELL,,,Block-Deals-03-11-2024-to-03-11-2025.csv
2025-09-09,PFC,GOLDMAN SACHS BANK EUROPE SE - ODI,BUY,,,Block-Deals-03-11-2024-to-03-11-2025.csv
2025-09-09,RECLTD,GOLDMAN SACHS (SINGAPORE) PTE - ODI,SELL,,,Block-Deals-03-11-2024-to-03-11-2025.csv
2025-09-09,RECLTD,GOLDMAN SACHS BANK EUROPE SE - ODI,BUY,,,Block-Deals-03-11-2024-to-03-11-2025.csv
2025-09-09,SWIGGY,GOLDMAN SACHS (SINGAPORE) PTE - ODI,SELL,,,Block-Deals-03-11-2024-to-03-11-2025.csv
2025-09-09,SWIGGY,GOLDMAN SACHS BANK EUROPE SE - ODI,BUY,,,Block-Deals-03-11-2024-to-03-11-2025.csv
2025-09-09,TATAMOTORS,KAPITALFORENINGEN INVESTIN PRO,BUY,,,Block-Deals-03-11-2024-to-03-11-2025.csv
2025-09-09,TATAMOTORS,KAPITALFORENINGEN PENSAM INVEST,SELL,,,Block-Deals-03-11-2024-to-03-11-2025.csv
2025-09-09,TCS,KAPITALFORENINGEN INVESTIN PRO,BUY,,,Block-Deals-03-11-2024-to-03-11-2025.csv
2025-09-09,TCS,KAPITALFORENINGEN PENSAM INVEST,SELL,,,Block-Deals-03-11-2024-to-03-11-2025.csv
2025-09-10,ETERNAL,GOLDMAN SACHS (SINGAPORE) PTE - ODI,SELL,,,Block-Deals-03-11-2024-to-03-11-2025.csv
2025-09-10,ETERNAL,GOLDMAN SACHS BANK EUROPE SE - ODI,BUY,,,Block-Deals-03-11-2024-to-03-11-2025.csv
2025-09-10,HCG,ACESO COMPANY PTE LTD.,SELL,,,Block-Deals-03-11-2024-to-03-11-2025.csv
2025-09-10,HCG,MORGAN STANLEY ASIA SINGAPORE PTE,BUY,,,Block-Deals-03-11-2024-to-03-11-2025.csv
2025-09-10,HCG,MOTILAL OSWAL MUTUAL FUND,BUY,,,Block-Deals-03-11-2024-to-03-11-2025.csv
2025-09-10,HCG,NIPPON INDIA MUTUAL FUND,BUY,,,Block-Deals-03-11-2024-to-03-11-2025.csv
2025-09-10,HCG,PLUTUS WEALTH MANAGEMENT LLP,BUY,,,Block-Deals-03-11-2024-to-03-11-2025.csv
2025-09-10,KOTAKBANK,360 ONE ASSET MANAGEMENT LIMITED - 360 ONE MULTICAP PMS,BUY,,,Block-Deals-03-11-2024-to-03-11-2025.csv
2025-09-10,KOTAKBANK,ABS DIRECT EQUITY FUND LLC - INDIA SERIES 1,BUY,,,Block-Deals-03-11-2024-to-03-11-2025.csv
2025-09-10,KOTAKBANK,ABU DHABI INVESTMENT AUTHORITY,BUY,,,Block-Deals-03-11-2024-to-03-11-2025.csv
2025-09-10,KOTAKBANK,ABU DHABI INVESTMENT AUTHORITY - STABLE,BUY,,,Block-Deals-03-11-2024-to-03-11-2025.csv
2025-09-10,KOTAKBANK,ADITYA BIRLA SUN LIFE DIVIDEND YIELD FUND,BUY,,,Block-Deals-03-11-2024-to-03-11-2025.csv
2025-09-10,KOTAKBANK,ADITYA BIRLA SUN LIFE MUTUAL FUND,BUY,,,Block-Deals-03-11-2024-to-03-11-2025.csv
2025-09-10,KOTAKBANK,ADITYA BIRLA SUN LIFE SPECIAL OPPORTUNITIES FUND,BUY,,,Block-Deals-03-11-2024-to-03-11-2025.csv
2025-09-10,KOTAKBANK,AL MEHWAR COMMERCIAL INVESTMENTS L.L.C.,BUY,,,Block-Deals-03-11-2024-to-03-11-2025.csv
2025-09-10,KOTAKBANK,AL MEHWAR COMMERCIAL INVESTMENTS L.L.C.,BUY,,,Block-Deals-03-11-2024-to-03-11-2025.csv
2025-09-10,KOTAKBANK,ALLIANZ GLOBAL INVESTORS FUND ALLIANZ RCM INDIA,BUY,,,Block-Deals-03-11-2024-to-03-11-2025.csv
2025-09-10,KOTAKBANK,AMUNDI FUNDS EMERGING MARKETS EQUITY FOCUS,BUY,,,Block-Deals-03-11-2024-to-03-11-2025.csv
2025-09-10,KOTAKBANK,AMUNDI FUNDS EMERGING MARKETS EQUITY FOCUS EX CHINA,BUY,,,Block-Deals-03-11-2024-to-03-11-2025.csv
2025-09-10,KOTAKBANK,AMUNDI FUNDS EMERGING WORLD EQUITY,BUY,,,Block-Deals-03-11-2024-to-03-11-2025.csv
2025-09-10,KOTAKBANK,ARANDA INVESTMENTS PTE LTD,BUY,,,Block-Deals-03-11-2024-to-03-11-2025.csv
2025-09-10,KOTAKBANK,ASHOKA INDIA EQUITY INVESTMENT TRUST PLC,BUY,,,Block-Deals-03-11-2024-to-03-11-2025.csv
2025-09-10,KOTAKBANK,ASHOKA INDIA OPPORTUNITIES FUND,BUY,,,Block-Deals-03-11-2024-to-03-11-2025.csv
2025-09-10,KOTAKBANK,ASHOKA WHITEOAK EMERGING MARKETS TRUST PLC,BUY,,,Block-Deals-03-11-2024-to-03-11-2025.csv
2025-09-10,KOTAKBANK,ASK ABSOLUTE RETURN FUND,BUY,,,Block-Deals-03-11-2024-to-03-11-2025.csv
2025-09-10,KOTAKBANK,AXIS MUTUAL FUND,BUY,,,Block-Deals-03-11-2024-to-03-11-2025.csv
2025-09-10,KOTAKBANK,BAJAJ ALLIANCE LIFE INSURANCE,BUY,,,Block-Deals-03-11-2024-to-03-11-2025.csv
2025-09-10,KOTAKBANK,BAJAJ ALLIANZ LIFE INSURANCE COMPANY LIMITED,BUY,,,Block-Deals-03-11-2024-to-03-11-2025.csv
2025-09-10,KOTAKBANK,BANDHAN BALANCED ADVANTAGE FUND / DEF,BUY,,,Block-Deals-03-11-2024-to-03-11-2025.csv
2025-09-10,KOTAKBANK,BANDHAN BUSINESS CYCLE FUND,BUY,,,Block-Deals-03-11-2024-to-03-11-2025.csv
2025-09-10,KOTAKBANK,BANDHAN FINANCIAL SERVICES FUND,BUY,,,Block-Deals-03-11-2024-to-03-11-2025.csv
2025-09-10,KOTAKBANK,BANDHAN MUTUAL FUND,BUY,,,Block-Deals-03-11-2024-to-03-11-2025.csv
2025-09-10,KOTAKBANK,BIRLA SUN LIFE EQUITY SAVINGS FUND,BUY,,,Block-Deals-03-11-2024-to-03-11-2025.csv
2025-09-10,KOTAKBANK,BIRLA SUNLIFE BANKING AND FINANCIAL SERVICES FUND,BUY,,,Block-Deals-03-11-2024-to-03-11-2025.csv
2025-09-10,KOTAKBANK,BLACKROCK GLOBAL FUNDS-INDIA FUND,BUY,,,Block-Deals-03-11-2024-to-03-11-2025.csv
2025-09-10,KOTAKBANK,BLACKROCK GLOBAL INVESTMENT SR GLOB EQ IN PORTFOLIO,BUY,,,Block-Deals-03-11-2024-to-03-11-2025.csv
2025-09-10,KOTAKBANK,BNP PARIBAS FINANCIAL MARKETS,BUY,,,Block-Deals-03-11-2024-to-03-11-2025.csv
2025-09-10,KOTAKBANK,BOFA SECURITIES EUROPE SA,BUY,,,Block-Deals-03-11-2024-to-03-11-2025.csv
2025-09-10,KOTAKBANK,BOFA SECURITIES EUROPE SA,BUY,,,Block-Deals-03-11-2024-to-03-11-2025.csv
2025-09-10,KOTAKBANK,CAISSE DE DEPOT ET PLACEMENT DU QUEBEC,BUY,,,Block-Deals-03-11-2024-to-03-11-2025.csv
2025-09-10,KOTAKBANK,CITIGROUP GLOBAL MARKETS MAURITIUS PRIVATE LIMITED,BUY,,,Block-Deals-03-11-2024-to-03-11-2025.csv
2025-09-10,KOTAKBANK,CITIGROUP GLOBAL MARKETS MAURITIUS PRIVATE LIMITED,BUY,,,Block-Deals-03-11-2024-to-03-11-2025.csv
2025-09-10,KOTAKBANK,COPTHALL MAURITIUS INVESTMENT LIMITED,BUY,,,Block-Deals-03-11-2024-to-03-11-2025.csv
2025-09-10,KOTAKBANK,DENDANA INVESTMENTS (MAURITIUS) LIMITED,BUY,,,Block-Deals-03-11-2024-to-03-11-2025.csv
2025-09-10,KOTAKBANK,DENDANA INVESTMENTS MAURITIUS LIMITED,BUY,,,Block-Deals-03-11-2024-to-03-11-2025.csv
2025-09-10,KOTAKBANK,DENDANA INVESTMENTS MAURITIUS LIMITED,BUY,,,Block-Deals-03-11-2024-to-03-11-2025.csv
2025-09-10,KOTAKBANK,DRAGON PEACOCK INVESTMENTS LIMITED,BUY,,,Block-Deals-03-11-2024-to-03-11-2025.csv
2025-09-10,KOTAKBANK,DSP BANKING AND FINANCIAL SERVICES FUND,BUY,,,Block-Deals-03-11-2024-to-03-11-2025.csv
2025-09-10,KOTAKBANK,DSP DYNAMIC ASSET ALLOCATION FUND,BUY,,,Block-Deals-03-11-2024-to-03-11-2025.csv
2025-09-10,KOTAKBANK,DSP ELSS TAX SAVER FUND,BUY,,,Block-Deals-03-11-2024-to-03-11-2025.csv
2025-09-10,KOTAKBANK,DSP EQUITY & BOND FUND,BUY,,,Block-Deals-03-11-2024-to-03-11-2025.csv
2025-09-10,KOTAKBANK,DSP EQUITY OPPORTUNITIES FUND,BUY,,,Block-Deals-03-11-2024-to-03-11-2025.csv
2025-09-10,KOTAKBANK,DSP MUTUAL FUND,BUY,,,Block-Deals-03-11-2024-to-03-11-2025.csv
2025-09-10,KOTAKBANK,DSP TOP 100 EQUITY FUND,BUY,,,Block-Deals-03-11-2024-to-03-11-2025.csv
2025-09-10,KOTAKBANK,EAST BRIDGE CAPITAL MASTER FUND I LIMITED,BUY,,,Block-Deals-03-11-2024-to-03-11-2025.csv
2025-09-10,KOTAKBANK,EASTSPRING INVESTMENTS - DRAGON PEACOCK FUND,BUY,,,Block-Deals-03-11-2024-to-03-11-2025.csv
2025-09-10,KOTAKBANK,EASTSPRING INVESTMENTS - INDIA EQUITY FUND,BUY,,,Block-Deals-03-11-2024-to-03-11-2025.csv
2025-09-10,KOTAKBANK,EASTSPRING INVESTMENTS INDIA CONSUMER EQUITY OPEN LIMITED,BUY,,,Block-Deals-03-11-2024-to-03-11-2025.csv
2025-09-10,KOTAKBANK,EASTSPRING INVESTMENTS INDIA CONSUMER EQUITY OPEN LIMITED,BUY,,,Block-Deals-03-11-2024-to-03-11-2025.csv
2025-09-10,KOTAKBANK,EASTSPRING INVESTMENTS INDIA EQUITY FUND,BUY,,,Block-Deals-03-11-2024-to-03-11-2025.csv
2025-09-10,KOTAKBANK,EASTSPRING INVESTMENTS INDIA EQUITY OPEN LIMITED,BUY,,,Block-Deals-03-11-2024-to-03-11-2025.csv
2025-09-10,KOTAKBANK,EASTSPRING INVESTMENTS INDIA EQUITY OPEN LIMITED,BUY,,,Block-Deals-03-11-2024-to-03-11-2025.csv
2025-09-10,KOTAKBANK,EASTSPRING INVESTMENTS INDIA INFRASTRUCTURE EQUITY OPEN LIMITED,BUY,,,Block-Deals-03-11-2024-to-03-11-2025.csv
2025-09-10,KOTAKBANK,EASTSPRING INVESTMENTS INDIA INFRASTRUCTURE EQUITY OPEN LTD,BUY,,,Block-Deals-03-11-2024-to-03-11-2025.csv
2025-09-10,KOTAKBANK,EMERGING MARKETS EQUITY TRUST,BUY,,,Block-Deals-03-11-2024-to-03-11-2025.csv
2025-09-10,KOTAKBANK,EMPLOYEES PROVIDENT FUND,BUY,,,Block-Deals-03-11-2024-to-03-11-2025.csv
2025-09-10,KOTAKBANK,EMPLOYEES PROVIDENT FUND BOARD MANAGED BY NOMURA ASSET MANAGEMENT MALAYSIA SDN BHD,BUY,,,Block-Deals-03-11-2024-to-03-11-2025.csv
2025-09-10,KOTAKBANK,ENTSORGUNGSFONDS,BUY,,,Block-Deals-03-11-2024-to-03-11-2025.csv
2025-09-10,KOTAKBANK,FACTORY MUTUAL INSURANCE COMPANY,BUY,,,Block-Deals-03-11-2024-to-03-11-2025.csv
2025-09-10,KOTAKBANK,FIDELITY FUNDS   INDIA FOCUS FUND,BUY,,,Block-Deals-03-11-2024-to-03-11-2025.csv
2025-09-10,KOTAKBANK,FIDELITY FUNDS.- INDIA FOCUS FUND,BUY,,,Block-Deals-03-11-2024-to-03-11-2025.csv
2025-09-10,KOTAKBANK,FIDELITY INDIA FUND,BUY,,,Block-Deals-03-11-2024-to-03-11-2025.csv
2025-09-10,KOTAKBANK,FIDELITY INDIA FUND,BUY,,,Block-Deals-03-11-2024-to-03-11-2025.csv
2025-09-10,KOTAKBANK,GOLDMAN SACHS BANK EUROPE SE,BUY,,,Block-Deals-03-11-2024-to-03-11-2025.csv
2025-09-10,KOTAKBANK,GOLDMAN SACHS INVESTMENTS MAURITIUS I LIMITED,BUY,,,Block-Deals-03-11-2024-to-03-11-2025.csv
2025-09-10,KOTAKBANK,GOVERNMENT PENSION FUND GLOBAL,BUY,,,Block-Deals-03-11-2024-to-03-11-2025.csv
2025-09-10,KOTAKBANK,GRD 13,BUY,,,Block-Deals-03-11-2024-to-03-11-2025.csv
2025-09-10,KOTAKBANK,HDFC MUTUAL FUND,BUY,,,Block-Deals-03-11-2024-to-03-11-2025.csv
2025-09-10,KOTAKBANK,HDFC MUTUAL FUND,BUY,,,Block-Deals-03-11-2024-to-03-11-2025.csv
2025-09-10,KOTAKBANK,HDFC MUTUAL FUND,BUY,,,Block-Deals-03-11-2024-to-03-11-2025.csv
2025-09-10,KOTAKBANK,HDFC MUTUAL FUND,BUY,,,Block-Deals-03-11-2024-to-03-11-2025.csv
2025-09-10,KOTAKBANK,ICICI PRUDENTIAL BANKING & FINANCIAL SERVICES FUND,BUY,,,Block-Deals-03-11-2024-to-03-11-2025.csv
2025-09-10,KOTAKBANK,ICICI PRUDENTIAL DIVIDEND YIELD EQUITY FUND,BUY,,,Block-Deals-03-11-2024-to-03-11-2025.csv
2025-09-10,KOTAKBANK,ICICI PRUDENTIAL EQUITY & DEBT FUND,BUY,,,Block-Deals-03-11-2024-to-03-11-2025.csv
2025-09-10,KOTAKBANK,ICICI PRUDENTIAL EQUITY AND DERIVATIVES FUND - WEALTH OPTIMISER PLAN / BALANCED ADVANTAGE FUND,BUY,,,Block-Deals-03-11-2024-to-03-11-2025.csv
2025-09-10,KOTAKBANK,ICICI PRUDENTIAL EQUITY MINIMUM VARIANCE FUND,BUY,,,Block-Deals-03-11-2024-to-03-11-2025.csv
2025-09-10,KOTAKBANK,ICICI PRUDENTIAL EQUITY SAVINGS FUND,BUY,,,Block-Deals-03-11-2024-to-03-11-2025.csv
2025-09-10,KOTAKBANK,ICICI PRUDENTIAL EXPORTS AND SERVICES FUND,BUY,,,Block-Deals-03-11-2024-to-03-11-2025.csv
2025-09-10,KOTAKBANK,ICICI PRUDENTIAL INDIA OPPORTUNITIES FUND,BUY,,,Block-Deals-03-11-2024-to-03-11-2025.csv
2025-09-10,KOTAKBANK,ICICI PRUDENTIAL LARGE & MID CAP FUND,BUY,,,Block-Deals-03-11-2024-to-03-11-2025.csv
2025-09-10,KOTAKBANK,ICICI PRUDENTIAL LIFE INSURANCE COMPANY LIMITED,BUY,,,Block-Deals-03-11-2024-to-03-11-2025.csv
2025-09-10,KOTAKBANK,ICICI PRUDENTIAL LONG TERM EQUITY FUND (TAX SAVING),BUY,,,Block-Deals-03-11-2024-to-03-11-2025.csv
2025-09-10,KOTAKBANK,ICICI PRUDENTIAL MULTI-ASSET FUND,BUY,,,Block-Deals-03-11-2024-to-03-11-2025.csv
2025-09-10,KOTAKBANK,ICICI PRUDENTIAL MUTUAL FUND,BUY,,,Block-Deals-03-11-2024-to-03-11-2025.csv
2025-09-10,KOTAKBANK,ICICI PRUDENTIAL REGULAR SAVINGS FUND,BUY,,,Block-Deals-03-11-2024-to-03-11-2025.csv
2025-09-10,KOTAKBANK,ICICI PRUDENTIAL VALUE DISCOVERY FUND,BUY,,,Block-Deals-03-11-2024-to-03-11-2025.csv
2025-09-10,KOTAKBANK,IDFC MUTUAL FUND A/C IDFC BALANCED FUND,BUY,,,Block-Deals-03-11-2024-to-03-11-2025.csv
2025-09-10,KOTAKBANK,IDFC MUTUAL FUND A/C IDFC EQUITY FUND,BUY,,,Block-Deals-03-11-2024-to-03-11-2025.csv
2025-09-10,KOTAKBANK,INDIA ACORN FUND LTD,BUY,,,Block-Deals-03-11-2024-to-03-11-2025.csv
2025-09-10,KOTAKBANK,INDIA ACORN ICAV - ASHOKA WHITEOAK EMERGING MARKETS EQUITY FUND,BUY,,,Block-Deals-03-11-2024-to-03-11-2025.csv
2025-09-10,KOTAKBANK,INDIA ACORN ICAV A/C ASHOKA INDIA OPPORTUNITIES FUND,BUY,,,Block-Deals-03-11-2024-to-03-11-2025.csv
2025-09-10,KOTAKBANK,INDIA ACORN ICAV ASHOKA INDIA ESG FUND,BUY,,,Block-Deals-03-11-2024-to-03-11-2025.csv
2025-09-10,KOTAKBANK,ITI BANKING AND FINANCIAL SERVICES FUND,BUY,,,Block-Deals-03-11-2024-to-03-11-2025.csv
2025-09-10,KOTAKBANK,ITI FLEXI CAP FUND,BUY,,,Block-Deals-03-11-2024-to-03-11-2025.csv
2025-09-10,KOTAKBANK,ITI MULTI CAP FUND,BUY,,,Block-Deals-03-11-2024-to-03-11-2025.csv
2025-09-10,KOTAKBANK,ITI VALUE FUND,BUY,,,Block-Deals-03-11-2024-to-03-11-2025.csv
2025-09-10,KOTAKBANK,KIFS FINSTOCK LIMITED,BUY,,,Block-Deals-03-11-2024-to-03-11-2025.csv
2025-09-10,KOTAKBANK,KIRAT INVESTMENTS PTE. LTD.,BUY,,,Block-Deals-03-11-2024-to-03-11-2025.csv
2025-09-10,KOTAKBANK,KOTAK MAHINDRA MUTUAL FUND,BUY,,,Block-Deals-03-11-2024-to-03-11-2025.csv
2025-09-10,KOTAKBANK,KOTAK MUTUAL FUND,BUY,,,Block-Deals-03-11-2024-to-03-11-2025.csv
2025-09-10,KOTAKBANK,LCL ACTIONS EMERGENTS,BUY,,,Block-Deals-03-11-2024-to-03-11-2025.csv
2025-09-10,KOTAKBANK,LOMBARD ODIER ASSET MGMT (SWITZERLAND) SA B/O AVADIS FUND AKTIEN EMERG MKTS,BUY,,,Block-Deals-03-11-2024-to-03-11-2025.csv
2025-09-10,KOTAKBANK,MANULIFE GLOBAL FUND INDIA EQUITY FUND,BUY,,,Block-Deals-03-11-2024-to-03-11-2025.csv
2025-09-10,KOTAKBANK,MANULIFE PROVIDENT FUNDS UNIT TRUST SERIES-MANULIFE PACIFIC ASIA EQY FUND,BUY,,,Block-Deals-03-11-2024-to-03-11-2025.csv
2025-09-10,KOTAKBANK,MC JAIN INFOSERVICES PRIVATE LIMITED,BUY,,,Block-Deals-03-11-2024-to-03-11-2025.csv
2025-09-10,KOTAKBANK,MIRAE ASSET AGGRESSIVE HYBRID FUND,BUY,,,Block-Deals-03-11-2024-to-03-11-2025.csv
2025-09-10,KOTAKBANK,MIRAE ASSET BALANCED ADVANTAGE FUND,BUY,,,Block-Deals-03-11-2024-to-03-11-2025.csv
2025-09-10,KOTAKBANK,MIRAE ASSET ELSS TAX SAVER FUND,BUY,,,Block-Deals-03-11-2024-to-03-11-2025.csv
2025-09-10,KOTAKBANK,MIRAE ASSET EQUITY SAVINGS FUND,BUY,,,Block-Deals-03-11-2024-to-03-11-2025.csv
2025-09-10,KOTAKBANK,MIRAE ASSET LARGE & MIDCAP FUND,BUY,,,Block-Deals-03-11-2024-to-03-11-2025.csv
2025-09-10,KOTAKBANK,MIRAE ASSET MULTICAP FUND,BUY,,,Block-Deals-03-11-2024-to-03-11-2025.csv
2025-09-10,KOTAKBANK,MIRAE ASSET MUTUAL FUND,BUY,,,Block-Deals-03-11-2024-to-03-11-2025.csv
2025-09-10,KOTAKBANK,MORGAN STANLEY ASIA (SINGAPORE) PTE. - ODI,BUY,,,Block-Deals-03-11-2024-to-03-11-2025.csv
2025-09-10,KOTAKBANK,MORGAN STANLEY ASIA SINGAPORE PTE,BUY,,,Block-Deals-03-11-2024-to-03-11-2025.csv
2025-09-10,KOTAKBANK,MORGAN STANLEY ASIA SINGAPORE PTE,BUY,,,Block-Deals-03-11-2024-to-03-11-2025.csv
2025-09-10,KOTAKBANK,MSAS NODI (7500P4D),BUY,,,Block-Deals-03-11-2024-to-03-11-2025.csv
2025-09-10,KOTAKBANK,MULTI MANAGER (CANADA) GLOBAL EQUITIES FUND,BUY,,,Block-Deals-03-11-2024-to-03-11-2025.csv
2025-09-10,KOTAKBANK,NIPPON INDIA MUTUAL FUND,BUY,,,Block-Deals-03-11-2024-to-03-11-2025.csv
2025-09-10,KOTAKBANK,NIPPON LIFE INDIA TRUSTEE LTD A/C NIPPON INDIA BANKING FUND,BUY,,,Block-Deals-03-11-2024-to-03-11-2025.csv
2025-09-10,KOTAKBANK,NIPPON LIFE INDIA TRUSTEE LTD A/C NIPPON INDIA LARGE CAP FUND,BUY,,,Block-Deals-03-11-2024-to-03-11-2025.csv
2025-09-10,KOTAKBANK,NOMURA A/C NOMURA FUND IRELAND PUBLIC LIMITED COMPANY NOMURA FUND IRELAND INDIA EQUITY FUND,BUY,,,Block-Deals-03-11-2024-to-03-11-2025.csv
2025-09-10,KOTAKBANK,NOMURA FUNDS IRELAND PLC-ASIA EX JAPAN HIGH CONVICTION FUND,BUY,,,Block-Deals-03-11-2024-to-03-11-2025.csv
2025-09-10,KOTAKBANK,NOMURA FUNDS IRELAND PLC/NOMURA FUNDS IRELAND - ASIA EX JAPAN HIGH CONVICTION FUND,BUY,,,Block-Deals-03-11-2024-to-03-11-2025.csv
2025-09-10,KOTAKBANK,NOMURA FUNDS IRELAND PUBLIC LIMITED COMPANY- NOMURA FUNDS IRELAND - INDIA EQUITY FUND,BUY,,,Block-Deals-03-11-2024-to-03-11-2025.csv
2025-09-10,KOTAKBANK,NOMURA INDIA INVESTMENT FUND MOTHER FUND A/C,BUY,,,Block-Deals-03-11-2024-to-03-11-2025.csv
2025-09-10,KOTAKBANK,NORDEA 1 SICAV,BUY,,,Block-Deals-03-11-2024-to-03-11-2025.csv
2025-09-10,KOTAKBANK,NORGES BANK ON ACCOUNT OF THE GOVERNMENT PENSION FUND GLOBAL,BUY,,,Block-Deals-03-11-2024-to-03-11-2025.csv
2025-09-10,KOTAKBANK,POLICE AND FIRE RETIREMENT SYSTEM OF THE CITY OF DETROIT,BUY,,,Block-Deals-03-11-2024-to-03-11-2025.csv
2025-09-10,KOTAKBANK,PRUDENTAL ASSET MGT (SINGAPORE) A/C PRU AST MGT SINGAPORE AC INT OPP FD DRAGON PEACOCK,BUY,,,Block-Deals-03-11-2024-to-03-11-2025.csv
2025-09-10,KOTAKBANK,PRUDENTIAL ASSET MGT. (SINGAPORE) A/C DRAGON PEACOCK INVESTMENTS LTD,BUY,,,Block-Deals-03-11-2024-to-03-11-2025.csv
2025-09-10,KOTAKBANK,PUBLIC SEC PEN INV BO IIFL AS MG L,BUY,,,Block-Deals-03-11-2024-to-03-11-2025.csv
2025-09-10,KOTAKBANK,SBI GENERAL INSURANCE COMPANY LIMITED - FRSM,BUY,,,Block-Deals-03-11-2024-to-03-11-2025.csv
2025-09-10,KOTAKBANK,SBI LIFE INSURANCE COMPANY LIMITED,BUY,,,Block-Deals-03-11-2024-to-03-11-2025.csv
2025-09-10,KOTAKBANK,SOCIETE GENERALE - ODI,BUY,,,Block-Deals-03-11-2024-to-03-11-2025.csv
2025-09-10,KOTAKBANK,STICHTING BEDRIJFSTAKPENSIOENFONDS VOOR HET BEROEPSVERVOER OVER DE WEG,BUY,,,Block-Deals-03-11-2024-to-03-11-2025.csv
2025-09-10,KOTAKBANK,STICHTING BEDRIJFSTAKPENSIONFONDS V,BUY,,,Block-Deals-03-11-2024-to-03-11-2025.csv
2025-09-10,KOTAKBANK,STICHTING BPS VOOR HET SCHILDERS- AFWERKINGS- EN GLASZETBEDRIJF,BUY,,,Block-Deals-03-11-2024-to-03-11-2025.csv
2025-09-10,KOTAKBANK,STICHTING DEPOSITARY APG EME MULTI CLIENT POOL,BUY,,,Block-Deals-03-11-2024-to-03-11-2025.csv
2025-09-10,KOTAKBANK,SUMITOMO MITSUI BANKING CORPORATION,SELL,,,Block-Deals-03-11-2024-to-03-11-2025.csv
2025-09-10,KOTAKBANK,SUMITOMO MITSUI BANKING CORPORATION,SELL,,,Block-Deals-03-11-2024-to-03-11-2025.csv
2025-09-10,KOTAKBANK,T ROWE PRICE ASIAN EQUITY (EX-JAPAN),BUY,,,Block-Deals-03-11-2024-to-03-11-2025.csv
2025-09-10,KOTAKBANK,T ROWE PRICE FUNDS SICAV ASIAN EX JAPAN EQUITY FUND,BUY,,,Block-Deals-03-11-2024-to-03-11-2025.csv
2025-09-10,KOTAKBANK,T ROWE PRICE FUNDS SICAV EMERGING MARKETS EQUITY FUND,BUY,,,Block-Deals-03-11-2024-to-03-11-2025.csv
2025-09-10,KOTAKBANK,T ROWE PRICE FUNDS SICAV GLOBAL ALLOCATION EXTENDED FUND,BUY,21.0,,Block-Deals-03-11-2024-to-03-11-2025.csv
2025-09-10,KOTAKBANK,T ROWE PRICE FUNDS SICAV GLOBAL ALLOCATION FUND,BUY,19.0,,Block-Deals-03-11-2024-to-03-11-2025.csv
2025-09-10,KOTAKBANK,T ROWE PRICE GLOBAL ALLOCATION FUND,BUY,246.0,,Block-Deals-03-11-2024-to-03-11-2025.csv
2025-09-10,KOTAKBANK,T ROWE PRICE GLOBAL ALLOCATION FUND,BUY,35.0,,Block-Deals-03-11-2024-to-03-11-2025.csv
2025-09-10,KOTAKBANK,T ROWE PRICE INSTITUTIONAL EMERGING MARKETS EQUITY FUND,BUY,,,Block-Deals-03-11-2024-to-03-11-2025.csv
2025-09-10,KOTAKBANK,T ROWE PRICE NEW ASIA FUN D,BUY,,,Block-Deals-03-11-2024-to-03-11-2025.csv
2025-09-10,KOTAKBANK,T ROWE PRICE RETIREMENT DATE TRUST T ROWE PRICE NON US EQUITIES TRUST,BUY,,,Block-Deals-03-11-2024-to-03-11-2025.csv
2025-09-10,KOTAKBANK,T. ROWE PRICE ASIAN EQUITY (EX-JAPAN),BUY,,,Block-Deals-03-11-2024-to-03-11-2025.csv
2025-09-10,KOTAKBANK,T. ROWE PRICE EMERGING MARKETS STOCK FUND,BUY,,,Block-Deals-03-11-2024-to-03-11-2025.csv
2025-09-10,KOTAKBANK,T. ROWE PRICE EMERGING MARKETS STOCK FUND,BUY,,,Block-Deals-03-11-2024-to-03-11-2025.csv
2025-09-10,KOTAKBANK,T. ROWE PRICE FUNDS SICAV- GLOBAL ALLOCATION EXTENDED FUND,BUY,21.0,,Block-Deals-03-11-2024-to-03-11-2025.csv
2025-09-10,KOTAKBANK,T. ROWE PRICE FUNDS SICAV-ASIAN EX-JAPAN EQUITY FUND,BUY,,,Block-Deals-03-11-2024-to-03-11-2025.csv
2025-09-10,KOTAKBANK,T. ROWE PRICE FUNDS SICAV-GLOBAL ALLOCATION FUND,BUY,20.0,,Block-Deals-03-11-2024-to-03-11-2025.csv
2025-09-10,KOTAKBANK,T. ROWE PRICE GLOBAL ALLOCATION FUND,BUY,36.0,,Block-Deals-03-11-2024-to-03-11-2025.csv
2025-09-10,KOTAKBANK,T. ROWE PRICE GLOBAL ALLOCATION FUND INC.,BUY,245.0,,Block-Deals-03-11-2024-to-03-11-2025.csv
2025-09-10,KOTAKBANK,T. ROWE PRICE INSTITUTIONAL EMERGING MARKETS EQUITY FUND,BUY,,,Block-Deals-03-11-2024-to-03-11-2025.csv
2025-09-10,KOTAKBANK,T. ROWE PRICE INTERNATIONAL INC.EMERGING MARKETS EQUITY TRUST,BUY,,,Block-Deals-03-11-2024-to-03-11-2025.csv
2025-09-10,KOTAKBANK,T. ROWE PRICE NEW ASIA FUND,BUY,,,Block-Deals-03-11-2024-to-03-11-2025.csv
2025-09-10,KOTAKBANK,T. ROWE PRICE RETIREMENT DATE TRUST T. ROWE PRICE NON-U.S. EQUITIES TRUST,BUY,,,Block-Deals-03-11-2024-to-03-11-2025.csv
2025-09-10,KOTAKBANK,TATA AIG GENERAL INSURANCE COMPANY LIMITED,BUY,,,Block-Deals-03-11-2024-to-03-11-2025.csv
2025-09-10,KOTAKBANK,TATA MUTUAL FUND,BUY,,,Block-Deals-03-11-2024-to-03-11-2025.csv
2025-09-10,KOTAKBANK,TATA MUTUAL FUND,BUY,,,Block-Deals-03-11-2024-to-03-11-2025.csv
2025-09-10,KOTAKBANK,TCW WHITE OAK EMERGING MARKETS EQUITY FUND,BUY,,,Block-Deals-03-11-2024-to-03-11-2025.csv
2025-09-10,KOTAKBANK,THE MTBJ A/C NOMURA INDIA INVES FD,BUY,,,Block-Deals-03-11-2024-to-03-11-2025.csv
2025-09-10,KOTAKBANK,TT ASIA EX JAPAN EQUITY FUND A SUB FUND OF TT INTERNATIONAL FUNDS PLC,BUY,,,Block-Deals-03-11-2024-to-03-11-2025.csv
2025-09-10,KOTAKBANK,TT CHINA FOCUS FUND A SUB-FUND OF TT INTERNATIONAL FUNDS PLC,BUY,,,Block-Deals-03-11-2024-to-03-11-2025.csv
2025-09-10,KOTAKBANK,VIRIDIAN ASIA OPPORTUNITIES MASTER FUND,BUY,,,Block-Deals-03-11-2024-to-03-11-2025.csv
2025-09-10,KOTAKBANK,VIRIDIAN ASIA OPPORTUNITIES MASTER FUND,BUY,,,Block-Deals-03-11-2024-to-03-11-2025.csv
2025-09-10,KOTAKBANK,WHITEOAK CAPITAL BALANCED ADVANTAGE FUND,BUY,,,Block-Deals-03-11-2024-to-03-11-2025.csv
2025-09-10,KOTAKBANK,WHITEOAK CAPITAL BALANCED HYBRID FUND,BUY,,,Block-Deals-03-11-2024-to-03-11-2025.csv
2025-09-10,KOTAKBANK,WHITEOAK CAPITAL BANKING & FINANCIAL SERVICES FUND,BUY,,,Block-Deals-03-11-2024-to-03-11-2025.csv
2025-09-10,KOTAKBANK,WHITEOAK CAPITAL EQUITY SAVINGS FUND,BUY,342.0,,Block-Deals-03-11-2024-to-03-11-2025.csv
2025-09-10,KOTAKBANK,WHITEOAK CAPITAL FLEXI CAP FUND,BUY,,,Block-Deals-03-11-2024-to-03-11-2025.csv
2025-09-10,KOTAKBANK,WHITEOAK CAPITAL LARGE AND MID CAP FUND,BUY,,,Block-Deals-03-11-2024-to-03-11-2025.csv
2025-09-10,KOTAKBANK,WHITEOAK CAPITAL LARGE CAP FUND,BUY,,,Block-Deals-03-11-2024-to-03-11-2025.csv
2025-09-10,KOTAKBANK,WHITEOAK CAPITAL MULTI ASSET ALLOCATION FUND,BUY,,,Block-Deals-03-11-2024-to-03-11-2025.csv
2025-09-10,KOTAKBANK,WHITEOAK CAPITAL MULTI CAP FUND,BUY,,,Block-Deals-03-11-2024-to-03-11-2025.csv
2025-09-10,KOTAKBANK,WHITEOAK CAPITAL MUTUAL FUND,BUY,,,Block-Deals-03-11-2024-to-03-11-2025.csv
2025-09-10,KOTAKBANK,WHITEOAK CAPITAL SPECIAL OPPORTUNITIES FUND,BUY,,,Block-Deals-03-11-2024-to-03-11-2025.csv
2025-09-10,KOTAKBANK,WHITEOAK CAPITAL TAX SAVER FUND,BUY,,,Block-Deals-03-11-2024-to-03-11-2025.csv
2025-09-10,SHRIRAMFIN,GOLDMAN SACHS (SINGAPORE) PTE - ODI,SELL,,,Block-Deals-03-11-2024-to-03-11-2025.csv
2025-09-10,SHRIRAMFIN,GOLDMAN SACHS BANK EUROPE SE - ODI,BUY,,,Block-Deals-03-11-2024-to-03-11-2025.csv
2025-09-10,VBL,GOLDMAN SACHS (SINGAPORE) PTE - ODI,SELL,,,Block-Deals-03-11-2024-to-03-11-2025.csv
2025-09-10,VBL,GOLDMAN SACHS BANK EUROPE SE - ODI,BUY,,,Block-Deals-03-11-2024-to-03-11-2025.csv
2025-09-11,BEL,GOLDMAN SACHS (SINGAPORE) PTE - ODI,SELL,,,Block-Deals-03-11-2024-to-03-11-2025.csv
2025-09-11,BEL,GOLDMAN SACHS BANK EUROPE SE - ODI,BUY,,,Block-Deals-03-11-2024-to-03-11-2025.csv
2025-09-11,BHARATFORG,GOLDMAN SACHS (SINGAPORE) PTE - ODI,SELL,,,Block-Deals-03-11-2024-to-03-11-2025.csv
2025-09-11,BHARATFORG,GOLDMAN SACHS BANK EUROPE SE - ODI,BUY,,,Block-Deals-03-11-2024-to-03-11-2025.csv
2025-09-11,BHARTIARTL,GOLDMAN SACHS (SINGAPORE) PTE - ODI,SELL,,,Block-Deals-03-11-2024-to-03-11-2025.csv
2025-09-11,BHARTIARTL,GOLDMAN SACHS BANK EUROPE SE - ODI,BUY,,,Block-Deals-03-11-2024-to-03-11-2025.csv
2025-09-11,ETERNAL,GOLDMAN SACHS (SINGAPORE) PTE - ODI,SELL,,,Block-Deals-03-11-2024-to-03-11-2025.csv
2025-09-11,ETERNAL,GOLDMAN SACHS BANK EUROPE SE - ODI,BUY,,,Block-Deals-03-11-2024-to-03-11-2025.csv
2025-09-11,INDIGO,GOLDMAN SACHS (SINGAPORE) PTE - ODI,SELL,,,Block-Deals-03-11-2024-to-03-11-2025.csv
2025-09-11,INDIGO,GOLDMAN SACHS BANK EUROPE SE - ODI,BUY,,,Block-Deals-03-11-2024-to-03-11-2025.csv
2025-09-11,KOTAKBANK,GOLDMAN SACHS (SINGAPORE) PTE - ODI,SELL,,,Block-Deals-03-11-2024-to-03-11-2025.csv
2025-09-11,KOTAKBANK,GOLDMAN SACHS BANK EUROPE SE - ODI,BUY,,,Block-Deals-03-11-2024-to-03-11-2025.csv
2025-09-11,PAYTM,GOLDMAN SACHS (SINGAPORE) PTE - ODI,SELL,,,Block-Deals-03-11-2024-to-03-11-2025.csv
2025-09-11,PAYTM,GOLDMAN SACHS BANK EUROPE SE - ODI,BUY,,,Block-Deals-03-11-2024-to-03-11-2025.csv
2025-09-11,SHRIRAMFIN,GOLDMAN SACHS (SINGAPORE) PTE - ODI,SELL,,,Block-Deals-03-11-2024-to-03-11-2025.csv
2025-09-11,SHRIRAMFIN,GOLDMAN SACHS BANK EUROPE SE - ODI,BUY,,,Block-Deals-03-11-2024-to-03-11-2025.csv
2025-09-12,BANKBARODA,MARSHALL WACE INVESTMENT STRATEGIES - EUREKA FUND,SELL,,,Block-Deals-03-11-2024-to-03-11-2025.csv
2025-09-12,BANKBARODA,SOCIETE GENERALE,BUY,,,Block-Deals-03-11-2024-to-03-11-2025.csv
2025-09-12,BHARTIARTL,GOLDMAN SACHS (SINGAPORE) PTE - ODI,SELL,,,Block-Deals-03-11-2024-to-03-11-2025.csv
2025-09-12,BHARTIARTL,GOLDMAN SACHS BANK EUROPE SE - ODI,BUY,,,Block-Deals-03-11-2024-to-03-11-2025.csv
2025-09-12,EICHERMOT,MARSHALL WACE INVESTMENT STRATEGIES - EUREKA FUND,SELL,,,Block-Deals-03-11-2024-to-03-11-2025.csv
2025-09-12,EICHERMOT,SOCIETE GENERALE,BUY,,,Block-Deals-03-11-2024-to-03-11-2025.csv
