Date,Symbol,Client_Name,Buy_Sell,Quantity,Price,Source
2025-05-29,BIRLANU,LTD ASHOK INVESTMENT CORPORAT ION,BUY,,,Block-Deals-03-11-2024-to-03-11-2025.csv
2025-05-29,BIRLANU,LTD CENTRAL INDIA INDUSTRIES,BUY,,,Block-Deals-03-11-2024-to-03-11-2025.csv
2025-05-29,BIRLANU,LTD GWALIOR FINANCE CORPORATION,BUY,,,Block-Deals-03-11-2024-to-03-11-2025.csv
2025-05-29,BIRLANU,ORIENT PAPER & INDUSTRIES LTD,SELL,,,Block-Deals-03-11-2024-to-03-11-2025.csv
2025-05-29,BIRLANU,SHEKHAVATI INVESTMENTS AND TRADERS LIMITED,BUY,,,Block-Deals-03-11-2024-to-03-11-2025.csv
2025-05-30,INDIGOPNTS,KOTAK MAHINDRA MUTUAL FUND,BUY,,,Block-Deals-03-11-2024-to-03-11-2025.csv
2025-05-30,INDIGOPNTS,PEAK XV PARTNERS INVESTMENTS IV,SELL,,,Block-Deals-03-11-2024-to-03-11-2025.csv
2025-05-30,INDIGOPNTS,PEAK XV PARTNERS INVESTMENTS V,SELL,,,Block-Deals-03-11-2024-to-03-11-2025.csv
2025-06-02,AUBANK,LEAPFROG RURAL INCLUSION (INDIA) LIMITED,SELL,,,Block-Deals-03-11-2024-to-03-11-2025.csv
2025-06-02,AUBANK,TATA AIG GENERAL INSURANCE CO LTD,BUY,,,Block-Deals-03-11-2024-to-03-11-2025.csv
2025-06-06,BAJAJFINSV,ADITYA BIRLA SUN LIFE MUTUAL FUND,BUY,,,Block-Deals-03-11-2024-to-03-11-2025.csv
2025-06-06,BAJAJFINSV,ASK ABSOLUTE RETURN FUND,BUY,,,Block-Deals-03-11-2024-to-03-11-2025.csv
2025-06-06,BAJAJFINSV,BAJAJ HOLDINGS AND INVESTMENT LIMITED,SELL,,,Block-Deals-03-11-2024-to-03-11-2025.csv
2025-06-06,BAJAJFINSV,BARCLAYS MERCHANT BANK (SINGAPORE) LIMITED,BUY,,,Block-Deals-03-11-2024-to-03-11-2025.csv
2025-06-06,BAJAJFINSV,BOFA SECURITIES EUROPE SA,BUY,,,Block-Deals-03-11-2024-to-03-11-2025.csv
2025-06-06,BAJAJFINSV,BOFA SECURITIES EUROPE SA - ODI,BUY,,,Block-Deals-03-11-2024-to-03-11-2025.csv
2025-06-06,BAJAJFINSV,CITIGROUP GLOBAL MARKETS MAURITIUS PVT LTD,BUY,,,Block-Deals-03-11-2024-to-03-11-2025.csv
2025-06-06,BAJAJFINSV,COPTHALL MAURITIUS INVESTMENT LIMITED,BUY,,,Block-Deals-03-11-2024-to-03-11-2025.csv
2025-06-06,BAJAJFINSV,DFC EMERGING MARKETS EQUITY FUND,BUY,420.0,,Block-Deals-03-11-2024-to-03-11-2025.csv
2025-06-06,BAJAJFINSV,DSP MUTUAL FUND,BUY,,,Block-Deals-03-11-2024-to-03-11-2025.csv
2025-06-06,BAJAJFINSV,EASTSPRING INVESTMENTS INDIA CONSUMER EQUITY OPEN LIMITED,BUY,,,Block-Deals-03-11-2024-to-03-11-2025.csv
2025-06-06,BAJAJFINSV,EASTSPRING INVESTMENTS INDIA EQUITY FUND,BUY,,,Block-Deals-03-11-2024-to-03-11-2025.csv
2025-06-06,BAJAJFINSV,EASTSPRING INVESTMENTS INDIA EQUITY OPEN LIMITED,BUY,,,Block-Deals-03-11-2024-to-03-11-2025.csv
2025-06-06,BAJAJFINSV,EDELWEISS MUTUAL FUND,BUY,,,Block-Deals-03-11-2024-to-03-11-2025.csv
2025-06-06,BAJAJFINSV,GOLDMAN SACHS (SINGAPORE) PTE,BUY,,,Block-Deals-03-11-2024-to-03-11-2025.csv
2025-06-06,BAJAJFINSV,GOLDMAN SACHS INVESTMENTS (MAURITIUS) I LIMITED  SHORT TERM,BUY,,,Block-Deals-03-11-2024-to-03-11-2025.csv
2025-06-06,BAJAJFINSV,HDFC MUTUAL FUND,BUY,,,Block-Deals-03-11-2024-to-03-11-2025.csv
2025-06-06,BAJAJFINSV,ICICI PRUDENTIAL LIFE INSURANCE COMPANY LIMITED,BUY,,,Block-Deals-03-11-2024-to-03-11-2025.csv
2025-06-06,BAJAJFINSV,ICICI PRUDENTIAL MUTUAL FUND,BUY,,,Block-Deals-03-11-2024-to-03-11-2025.csv
2025-06-06,BAJAJFINSV,INDIA ACORN ICAV - ASHOKA WHITEOAK EMERGING MARKETS EQUITY FUND,BUY,,,Block-Deals-03-11-2024-to-03-11-2025.csv
2025-06-06,BAJAJFINSV,INSTITUTIONAL VANDHA A/C,BUY,,,Block-Deals-03-11-2024-to-03-11-2025.csv
2025-06-06,BAJAJFINSV,JAMNALAL SONS PRIVATE LIMITED,SELL,,,Block-Deals-03-11-2024-to-03-11-2025.csv
2025-06-06,BAJAJFINSV,JAPAN TRUSTEES SERVICE BANK LTD A/C JF INDIA EQUITY OPEN MOTHER FUND,BUY,,,Block-Deals-03-11-2024-to-03-11-2025.csv
2025-06-06,BAJAJFINSV,JP MORGAN FUNDS,BUY,,,Block-Deals-03-11-2024-to-03-11-2025.csv
2025-06-06,BAJAJFINSV,JPMORGAN INDIA FUND,BUY,,,Block-Deals-03-11-2024-to-03-11-2025.csv
2025-06-06,BAJAJFINSV,JPMORGAN INDIAN INVESTMENT TRUST PLC,BUY,,,Block-Deals-03-11-2024-to-03-11-2025.csv
2025-06-06,BAJAJFINSV,LANSFORSAKRINGAR TILLVAXTMARKNAD AKTIV,BUY,,,Block-Deals-03-11-2024-to-03-11-2025.csv
2025-06-06,BAJAJFINSV,LEADING LIGHT FUND VCC - THE TRIUMPH FUND,BUY,,,Block-Deals-03-11-2024-to-03-11-2025.csv
2025-06-06,BAJAJFINSV,MORGAN STANLEY ASIA SINGAPORE PTE,BUY,,,Block-Deals-03-11-2024-to-03-11-2025.csv
2025-06-06,BAJAJFINSV,MORGAN STANLEY ASIA SINGAPORE PTE,BUY,,,Block-Deals-03-11-2024-to-03-11-2025.csv
2025-06-06,BAJAJFINSV,NOMURA SINGAPORE LIMITED,BUY,,,Block-Deals-03-11-2024-to-03-11-2025.csv
2025-06-06,BAJAJFINSV,NTCC COLL FUNDS FOR EMPLOYEE BENEFIT TRUST -NTCC EMERGING MARKETS FUND FEBT,BUY,,,Block-Deals-03-11-2024-to-03-11-2025.csv
2025-06-06,BAJAJFINSV,OP-INDIA FUND,BUY,,,Block-Deals-03-11-2024-to-03-11-2025.csv
2025-06-06,BAJAJFINSV,PRUDENTAL ASSET MGT (SINGAPORE) A/C PRU AST MGT SINGAPORE AC INT OPP FD DRAGON PEACOCK,BUY,,,Block-Deals-03-11-2024-to-03-11-2025.csv
2025-06-06,BAJAJFINSV,PRUDENTIAL ASSET MGT. (SINGAPORE) A/C DRAGON PEACOCK INVESTMENTS LTD,BUY,,,Block-Deals-03-11-2024-to-03-11-2025.csv
2025-06-06,BAJAJFINSV,SBI LIFE INSURANCE COMPANY LIMITED,BUY,,,Block-Deals-03-11-2024-to-03-11-2025.csv
2025-06-06,BAJAJFINSV,SBI MUTUAL FUND,BUY,,,Block-Deals-03-11-2024-to-03-11-2025.csv
2025-06-06,BAJAJFINSV,SCOTIA PRIVATE EMERGING MARKETS POOL,BUY,,,Block-Deals-03-11-2024-to-03-11-2025.csv
2025-06-06,BAJAJFINSV,SOCIETE GENERALE,BUY,,,Block-Deals-03-11-2024-to-03-11-2025.csv
2025-06-06,BAJAJFINSV,TARA EMERGING ASIA LIQUID FUND,BUY,,,Block-Deals-03-11-2024-to-03-11-2025.csv
2025-06-06,BAJAJFINSV,TATA EQUITY PLUS ABSOLUTE RETURNS FUND,BUY,,,Block-Deals-03-11-2024-to-03-11-2025.csv
2025-06-06,BAJAJFINSV,TATA MUTUAL FUND,BUY,,,Block-Deals-03-11-2024-to-03-11-2025.csv
2025-06-06,BAJAJFINSV,THE INCUBATION FUND LIMITED,BUY,23.0,,Block-Deals-03-11-2024-to-03-11-2025.csv
2025-06-06,BAJAJFINSV,VANGUARD EMERGING MARKETS SELECT STOCK FUND,BUY,,,Block-Deals-03-11-2024-to-03-11-2025.csv
2025-06-06,BAJAJFINSV,VIRIDIAN ASIA OPPORTUNITIES MASTER FUND,BUY,,,Block-Deals-03-11-2024-to-03-11-2025.csv
2025-06-06,BAJAJFINSV,WELLINGTON MANAGEMENT FUNDS (LUXEMBOURG) III SICAV - WELLINGTON EMERGING MAR RESEACH EQ CORE FD,BUY,921.0,,Block-Deals-03-11-2024-to-03-11-2025.csv
2025-06-06,BAJAJFINSV,WMF (LUXEMBOURG)- WELLINGTON EMERGING MARKETS RESEARCH EQUITY FUND,BUY,,,Block-Deals-03-11-2024-to-03-11-2025.csv
2025-06-06,BAJAJFINSV,WMF LUXEMBOURG II SICAV WELLINGTON GLOBAL MULTI ASSET TARGET RETURN FUND,BUY,552.0,,Block-Deals-03-11-2024-to-03-11-2025.csv
2025-06-06,BAJAJFINSV,WTCNAM CIF TRUST II EMERGING MARKETS RESEARCH EQUITY PORTFOLIO,BUY,,,Block-Deals-03-11-2024-to-03-11-2025.csv
2025-06-06,BAJAJFINSV,WTCNAM COMMON TRUST FUNDS TRUST EMERGING MARKETS RESEARCH EQUITY PORTFOLIO,BUY,,,Block-Deals-03-11-2024-to-03-11-2025.csv
2025-06-06,BAJAJFINSV,ZURICH INVEST INSTITUTIONAL FUNDS - ZIF AKTIEN EMERGING MARKETS,BUY,,,Block-Deals-03-11-2024-to-03-11-2025.csv
2025-06-06,ZFCVINDIA,ADITYA BIRLA SUNLIFE MUTUAL FUND,BUY,,,Block-Deals-03-11-2024-to-03-11-2025.csv
2025-06-06,ZFCVINDIA,BANDHAN MUTUAL FUND,BUY,,,Block-Deals-03-11-2024-to-03-11-2025.csv
2025-06-06,ZFCVINDIA,CITIGROUP GLOBAL MARKETS MAURITIUS PVT LTD,BUY,,,Block-Deals-03-11-2024-to-03-11-2025.csv
2025-06-06,ZFCVINDIA,EDELWEISS MUTUAL FUND,BUY,,,Block-Deals-03-11-2024-to-03-11-2025.csv
2025-06-06,ZFCVINDIA,FRANKLIN TEMPLETON MUTUAL FUND,BUY,,,Block-Deals-03-11-2024-to-03-11-2025.csv
2025-06-06,ZFCVINDIA,GHISALLO MASTER FUND LP,BUY,,,Block-Deals-03-11-2024-to-03-11-2025.csv
2025-06-06,ZFCVINDIA,GOLDMAN SACHS (SINGAPORE) PTE,BUY,,,Block-Deals-03-11-2024-to-03-11-2025.csv
2025-06-06,ZFCVINDIA,HDFC STANDARD LIFE INSURANCE COMPANY LIMITED,BUY,,,Block-Deals-03-11-2024-to-03-11-2025.csv
2025-06-06,ZFCVINDIA,ICICI PRUDENTIAL MUTUAL FUND,BUY,,,Block-Deals-03-11-2024-to-03-11-2025.csv
2025-06-06,ZFCVINDIA,INVESCO MUTUAL FUND,BUY,,,Block-Deals-03-11-2024-to-03-11-2025.csv
2025-06-06,ZFCVINDIA,KOTAK MAHINDRA MUTUAL FUND,BUY,,,Block-Deals-03-11-2024-to-03-11-2025.csv
2025-06-06,ZFCVINDIA,NIPPON INDIA MUTUAL FUND,BUY,,,Block-Deals-03-11-2024-to-03-11-2025.csv
2025-06-06,ZFCVINDIA,SOCIETE GENERALE,BUY,,,Block-Deals-03-11-2024-to-03-11-2025.csv
2025-06-06,ZFCVINDIA,SUNDARAM MUTUAL FUND,BUY,,,Block-Deals-03-11-2024-to-03-11-2025.csv
2025-06-06,ZFCVINDIA,UTI MUTUAL FUND,BUY,,,Block-Deals-03-11-2024-to-03-11-2025.csv
2025-06-06,ZFCVINDIA,WABCO ASIA PRIVATE LIMITED,SELL,,,Block-Deals-03-11-2024-to-03-11-2025.csv
2025-06-09,SUZLON,ADITYA BIRLA SUN LIFE MUTUAL FUND,BUY,,,Block-Deals-03-11-2024-to-03-11-2025.csv
2025-06-09,SUZLON,ASK ABSOLUTE RETURN FUND,BUY,,,Block-Deals-03-11-2024-to-03-11-2025.csv
2025-06-09,SUZLON,BAJAJ ALLIANZ LIFE INSURANCE COMPANY LIMITED,BUY,,,Block-Deals-03-11-2024-to-03-11-2025.csv
2025-06-09,SUZLON,BANDHAN MUTUAL FUND,BUY,,,Block-Deals-03-11-2024-to-03-11-2025.csv
2025-06-09,SUZLON,EDELWEISS LIFE INSURANCE COMPANY LIMITED,BUY,,,Block-Deals-03-11-2024-to-03-11-2025.csv
2025-06-09,SUZLON,EDELWEISS MUTUAL FUND,BUY,,,Block-Deals-03-11-2024-to-03-11-2025.csv
2025-06-09,SUZLON,FUTURE GENERALI INDIA LIFE INSURANCE COMPANY LIMITED,BUY,,,Block-Deals-03-11-2024-to-03-11-2025.csv
2025-06-09,SUZLON,GOLDMAN SACHS (SINGAPORE) PTE,BUY,,,Block-Deals-03-11-2024-to-03-11-2025.csv
2025-06-09,SUZLON,GOLDMAN SACHS FUNDS-GOLDMAN SACHS ASIA EQUITY PORTFOLIO,BUY,,,Block-Deals-03-11-2024-to-03-11-2025.csv
2025-06-09,SUZLON,ICICI PRUDENTIAL LIFE INSURANCE COMPANY LIMITED,BUY,,,Block-Deals-03-11-2024-to-03-11-2025.csv
2025-06-09,SUZLON,INVESCO MUTUAL FUND,BUY,,,Block-Deals-03-11-2024-to-03-11-2025.csv
2025-06-09,SUZLON,JAIDEEP SAMPAT,BUY,,,Block-Deals-03-11-2024-to-03-11-2025.csv
2025-06-09,SUZLON,KIFS FINSTOCK LIMITED,BUY,,,Block-Deals-03-11-2024-to-03-11-2025.csv
2025-06-09,SUZLON,MORGAN STANLEY ASIA SINGAPORE PTE,BUY,,,Block-Deals-03-11-2024-to-03-11-2025.csv
2025-06-09,SUZLON,MOTILAL OSWAL MUTUAL FUND,BUY,,,Block-Deals-03-11-2024-to-03-11-2025.csv
2025-06-09,SUZLON,RAMBHABEN UKABHAI TANTI,SELL,,,Block-Deals-03-11-2024-to-03-11-2025.csv
2025-06-09,SUZLON,SOCIETE GENERALE,BUY,,,Block-Deals-03-11-2024-to-03-11-2025.csv
2025-06-09,SUZLON,SUNDARAM MUTUAL FUND,BUY,,,Block-Deals-03-11-2024-to-03-11-2025.csv
2025-06-09,SUZLON,TANTI HOLDINGS PRIVATE LIMITED,SELL,,,Block-Deals-03-11-2024-to-03-11-2025.csv
2025-06-09,SUZLON,TANTI RANCHHODBHAI RAMJIB HAI,SELL,,,Block-Deals-03-11-2024-to-03-11-2025.csv
2025-06-09,SUZLON,VINOD RANCHHODBHAI TANTI,SELL,,,Block-Deals-03-11-2024-to-03-11-2025.csv
2025-06-09,WIPRO,AZIM PREMJI TRUST,SELL,,,Block-Deals-03-11-2024-to-03-11-2025.csv
2025-06-09,WIPRO,HASHAM TRADERS,BUY,,,Block-Deals-03-11-2024-to-03-11-2025.csv
2025-06-09,WIPRO,PRAZIM TRADERS,BUY,,,Block-Deals-03-11-2024-to-03-11-2025.csv
2025-06-09,WIPRO,PRAZIM TRADING AND INVESTMENT COMPANY PRIVATE LIMITED,BUY,,,Block-Deals-03-11-2024-to-03-11-2025.csv
2025-06-10,BAJFINANCE,NEW HORIZON OPPORTUNITIES MASTER FUND,BUY,,,Block-Deals-03-11-2024-to-03-11-2025.csv
2025-06-10,BAJFINANCE,NEW HORIZON OPPORTUNITIES MASTER FUND,SELL,,,Block-Deals-03-11-2024-to-03-11-2025.csv
2025-06-10,PREMIERENE,360 ONE ASSET MANAGEMENT LIMITED,BUY,,,Block-Deals-03-11-2024-to-03-11-2025.csv
2025-06-10,PREMIERENE,AGEAS FEDERAL LIFE INSURANCE COMPANY LIMITED,BUY,,,Block-Deals-03-11-2024-to-03-11-2025.csv
2025-06-10,PREMIERENE,AL MEHWAR COMMERCIAL INVESTMENTS L.L.C.,BUY,,,Block-Deals-03-11-2024-to-03-11-2025.csv
2025-06-10,PREMIERENE,AXIS MUTUAL FUND,BUY,,,Block-Deals-03-11-2024-to-03-11-2025.csv
2025-06-10,PREMIERENE,BANDHAN MUTUAL FUND,BUY,,,Block-Deals-03-11-2024-to-03-11-2025.csv
2025-06-10,PREMIERENE,BLACKSTONE AQUA MASTER SUB-FUND,BUY,,,Block-Deals-03-11-2024-to-03-11-2025.csv
2025-06-10,PREMIERENE,CITIGROUP GLOBAL MARKETS MAURITIUS PRIVATE LIMITED,BUY,,,Block-Deals-03-11-2024-to-03-11-2025.csv
2025-06-10,PREMIERENE,CITIGROUP GLOBAL MARKETS MAURITIUS PRIVATE LIMITED,BUY,,,Block-Deals-03-11-2024-to-03-11-2025.csv
2025-06-10,PREMIERENE,EDELWEISS MUTUAL FUND,BUY,,,Block-Deals-03-11-2024-to-03-11-2025.csv
2025-06-10,PREMIERENE,GHISALLO MASTER FUND LP,BUY,,,Block-Deals-03-11-2024-to-03-11-2025.csv
2025-06-10,PREMIERENE,GOLDMAN SACHS (SINGAPORE) PTE,BUY,,,Block-Deals-03-11-2024-to-03-11-2025.csv
2025-06-10,PREMIERENE,GOLDMAN SACHS INVESTMENTS MAURITIUS I LIMITED,BUY,,,Block-Deals-03-11-2024-to-03-11-2025.csv
2025-06-10,PREMIERENE,HDFC LIFE INSURANCE COMPANY LIMITED,BUY,,,Block-Deals-03-11-2024-to-03-11-2025.csv
2025-06-10,PREMIERENE,ICICI PRUDENTIAL MUTUAL FUND,BUY,,,Block-Deals-03-11-2024-to-03-11-2025.csv
2025-06-10,PREMIERENE,KOTAK MAHINDRA LIFE INSURANCE COMPANY LIMITED,BUY,,,Block-Deals-03-11-2024-to-03-11-2025.csv
2025-06-10,PREMIERENE,MORGAN STANLEY ASIA SINGAPORE PTE,BUY,,,Block-Deals-03-11-2024-to-03-11-2025.csv
2025-06-10,PREMIERENE,MORGAN STANLEY ASIA SINGAPORE PTE,BUY,,,Block-Deals-03-11-2024-to-03-11-2025.csv
2025-06-10,PREMIERENE,MOTILAL OSWAL MUTUAL FUND,BUY,,,Block-Deals-03-11-2024-to-03-11-2025.csv
2025-06-10,PREMIERENE,NOMURA SINGAPORE LIMITED,BUY,,,Block-Deals-03-11-2024-to-03-11-2025.csv
2025-06-10,PREMIERENE,PI OPPORTUNITIES AIF V LLP,BUY,,,Block-Deals-03-11-2024-to-03-11-2025.csv
2025-06-10,PREMIERENE,PUBLIC SECTOR PENSION INVESTMENT BOARD,BUY,,,Block-Deals-03-11-2024-to-03-11-2025.csv
2025-06-10,PREMIERENE,QUANT MUTUAL FUND,BUY,,,Block-Deals-03-11-2024-to-03-11-2025.csv
2025-06-10,PREMIERENE,SBI LIFE INSURANCE COMPANY LIMITED,BUY,,,Block-Deals-03-11-2024-to-03-11-2025.csv
2025-06-10,PREMIERENE,SOCIETE GENERALE,BUY,,,Block-Deals-03-11-2024-to-03-11-2025.csv
2025-06-10,PREMIERENE,SOUTH ASIA GROWTH FUND II HOLDINGS LLC,SELL,,,Block-Deals-03-11-2024-to-03-11-2025.csv
2025-06-10,PREMIERENE,THELEME INDIA MASTER FUND LIMITED,BUY,,,Block-Deals-03-11-2024-to-03-11-2025.csv
2025-06-11,ABCAPITAL,EDELWEISS MUTUAL FUND,BUY,,,Block-Deals-03-11-2024-to-03-11-2025.csv
2025-06-11,ABCAPITAL,GOLDMAN SACHS ETF TRUST  GOLDMAN SACHS INDIA EQUITY ETF,BUY,,,Block-Deals-03-11-2024-to-03-11-2025.csv
2025-06-11,ABCAPITAL,GOLDMAN SACHS FUNDS  GOLDMAN SACHS INDIA EQUITY PORTFOLIO,BUY,,,Block-Deals-03-11-2024-to-03-11-2025.csv
2025-06-11,ABCAPITAL,GREATER INDIA PORTFOLIO,BUY,,,Block-Deals-03-11-2024-to-03-11-2025.csv
2025-06-11,ABCAPITAL,GS INDIA EQUITY,BUY,,,Block-Deals-03-11-2024-to-03-11-2025.csv
2025-06-11,ABCAPITAL,HSBC MUTUAL FUND,BUY,,,Block-Deals-03-11-2024-to-03-11-2025.csv
2025-06-11,ABCAPITAL,JOMEI INVESTMENTS LIMITED,SELL,,,Block-Deals-03-11-2024-to-03-11-2025.csv
2025-06-11,ABCAPITAL,LIC MUTUAL FUND,BUY,,,Block-Deals-03-11-2024-to-03-11-2025.csv
2025-06-11,ABCAPITAL,LIC MUTUAL FUND,BUY,,,Block-Deals-03-11-2024-to-03-11-2025.csv
2025-06-11,ABCAPITAL,LIC MUTUAL FUND.,BUY,,,Block-Deals-03-11-2024-to-03-11-2025.csv
2025-06-11,ABCAPITAL,MANULIFE GLOBAL FUND INDIA EQUITY FUND,BUY,,,Block-Deals-03-11-2024-to-03-11-2025.csv
2025-06-11,ABCAPITAL,MEDIOLANUM BEST BRANDS MEDIOLANUM INDIA OPPORTUNITIES,BUY,,,Block-Deals-03-11-2024-to-03-11-2025.csv
2025-06-11,ABCAPITAL,MOTILAL OSWAL MUTUAL FUND,BUY,,,Block-Deals-03-11-2024-to-03-11-2025.csv
2025-06-11,ABCAPITAL,MOTILAL OSWAL MUTUAL FUND,BUY,,,Block-Deals-03-11-2024-to-03-11-2025.csv
2025-06-11,ABCAPITAL,MOTILAL OSWAL MUTUAL FUND,BUY,,,Block-Deals-03-11-2024-to-03-11-2025.csv
2025-06-11,ABCAPITAL,NEW YORK STATE TEACHERS RETIREMENT SYSTEM,BUY,,,Block-Deals-03-11-2024-to-03-11-2025.csv
2025-06-11,ABCAPITAL,NORDEA 1 SICAV,BUY,,,Block-Deals-03-11-2024-to-03-11-2025.csv
2025-06-11,BAJFINANCE,NEW HORIZON OPPORTUNITIES MASTER FUND,SELL,,,Block-Deals-03-11-2024-to-03-11-2025.csv
2025-06-11,BAJFINANCE,NEW HORIZON OPPORTUNITIES MASTER FUND,BUY,,,Block-Deals-03-11-2024-to-03-11-2025.csv
2025-06-11,ETERNAL,MARSHALL WACE INVESTMENT STRATEGIES - EUREKA FUND,SELL,,,Block-Deals-03-11-2024-to-03-11-2025.csv
2025-06-11,ETERNAL,SOCIETE GENERALE,BUY,,,Block-Deals-03-11-2024-to-03-11-2025.csv
2025-06-11,ICICIBANK,MARSHALL WACE INVESTMENT STRATEGIES - EUREKA FUND,SELL,,,Block-Deals-03-11-2024-to-03-11-2025.csv
2025-06-11,ICICIBANK,SOCIETE GENERALE,BUY,,,Block-Deals-03-11-2024-to-03-11-2025.csv
2025-06-11,LT,PI OPPORTUNITIES AIF V LLP,BUY,,,Block-Deals-03-11-2024-to-03-11-2025.csv
2025-06-11,LT,PIONEER INVESTMENT FUND,SELL,,,Block-Deals-03-11-2024-to-03-11-2025.csv
2025-06-11,M&M,MARSHALL WACE INVESTMENT STRATEGIES - EUREKA FUND,SELL,,,Block-Deals-03-11-2024-to-03-11-2025.csv
2025-06-11,M&M,PI OPPORTUNITIES AIF V LLP,BUY,,,Block-Deals-03-11-2024-to-03-11-2025.csv
2025-06-11,M&M,PIONEER INVESTMENT FUND,SELL,,,Block-Deals-03-11-2024-to-03-11-2025.csv
2025-06-11,M&M,SOCIETE GENERALE,BUY,,,Block-Deals-03-11-2024-to-03-11-2025.csv
2025-06-11,MARKSANS,BANDHAN MUTUAL FUND,BUY,,,Block-Deals-03-11-2024-to-03-11-2025.csv
2025-06-11,MARKSANS,CITIGROUP GLOBAL MARKETS SINGAPORE PTE LIMITED,BUY,,,Block-Deals-03-11-2024-to-03-11-2025.csv
2025-06-11,MARKSANS,ORBIMED ASIA IV MAURITIUS FVCI LIMITED,SELL,,,Block-Deals-03-11-2024-to-03-11-2025.csv
2025-06-11,MARKSANS,SOCIETE GENERALE,BUY,,,Block-Deals-03-11-2024-to-03-11-2025.csv
2025-06-11,MARKSANS,SUBHKAM VENTURES I PRIVATE LIMITED,BUY,,,Block-Deals-03-11-2024-to-03-11-2025.csv
2025-06-11,MARKSANS,UNIFI BCAD FUND,BUY,,,Block-Deals-03-11-2024-to-03-11-2025.csv
2025-06-11,MARKSANS,UNIFI BLEND FUND 2,BUY,,,Block-Deals-03-11-2024-to-03-11-2025.csv
2025-06-11,MARKSANS,UNIFI CAPITAL PRIVATE LIMITED,BUY,,,Block-Deals-03-11-2024-to-03-11-2025.csv
2025-06-11,MARKSANS,UNIFI CAPITAL PRIVATE LIMITED -BLENDED RANGOLI,BUY,,,Block-Deals-03-11-2024-to-03-11-2025.csv
2025-06-11,MARKSANS,UTI MUTUAL FUND,BUY,,,Block-Deals-03-11-2024-to-03-11-2025.csv
2025-06-11,SCHAEFFLER,MARSHALL WACE INVESTMENT STRATEGIES - EUREKA FUND,SELL,,,Block-Deals-03-11-2024-to-03-11-2025.csv
2025-06-11,SCHAEFFLER,SOCIETE GENERALE,BUY,,,Block-Deals-03-11-2024-to-03-11-2025.csv
2025-06-11,UNOMINDA,MARSHALL WACE INVESTMENT STRATEGIES - EUREKA FUND,SELL,,,Block-Deals-03-11-2024-to-03-11-2025.csv
2025-06-11,UNOMINDA,SOCIETE GENERALE,BUY,,,Block-Deals-03-11-2024-to-03-11-2025.csv
2025-06-11,WIPRO,AZIM PREMJI TRUST,SELL,,,Block-Deals-03-11-2024-to-03-11-2025.csv
2025-06-11,WIPRO,PRAZIM TRADERS,BUY,,,Block-Deals-03-11-2024-to-03-11-2025.csv
2025-06-11,WIPRO,ZASH TRADERS,BUY,,,Block-Deals-03-11-2024-to-03-11-2025.csv
2025-06-12,ASIANPAINT,SBI MUTUAL FUND,BUY,,,Block-Deals-03-11-2024-to-03-11-2025.csv
2025-06-12,ASIANPAINT,SIDDHANT COMMERCIALS PRIVATE LIMITED,SELL,,,Block-Deals-03-11-2024-to-03-11-2025.csv
2025-06-12,BAJFINANCE,NEW HORIZON OPPORTUNITIES MASTER FUND,SELL,,,Block-Deals-03-11-2024-to-03-11-2025.csv
2025-06-12,BAJFINANCE,NEW HORIZON OPPORTUNITIES MASTER FUND,BUY,,,Block-Deals-03-11-2024-to-03-11-2025.csv
2025-06-12,ETERNAL,MARSHALL WACE INVESTMENT STRATEGIES - EUREKA FUND,SELL,,,Block-Deals-03-11-2024-to-03-11-2025.csv
2025-06-12,ETERNAL,SOCIETE GENERALE,BUY,,,Block-Deals-03-11-2024-to-03-11-2025.csv
2025-06-12,SCHAEFFLER,MARSHALL WACE INVESTMENT STRATEGIES - EUREKA FUND,SELL,,,Block-Deals-03-11-2024-to-03-11-2025.csv
2025-06-12,SCHAEFFLER,SOCIETE GENERALE,BUY,,,Block-Deals-03-11-2024-to-03-11-2025.csv
2025-06-13,BAJFINANCE,NEW HORIZON OPPORTUNITIES MASTER FUND,SELL,,,Block-Deals-03-11-2024-to-03-11-2025.csv
2025-06-13,BAJFINANCE,NEW HORIZON OPPORTUNITIES MASTER FUND,BUY,,,Block-Deals-03-11-2024-to-03-11-2025.csv
2025-06-13,JUBLFOOD,AIMCO AS A TRUSTEE OF THE GOVERNMENT OF THE PROVINCE OF ALBERTA,BUY,,,Block-Deals-03-11-2024-to-03-11-2025.csv
2025-06-13,JUBLFOOD,BAJAJ ALLIANZ LIFE INSURANCE COMPANY LIMITED,BUY,,,Block-Deals-03-11-2024-to-03-11-2025.csv
2025-06-13,JUBLFOOD,BANDHAN MUTUAL FUND,BUY,,,Block-Deals-03-11-2024-to-03-11-2025.csv
2025-06-13,JUBLFOOD,BNP PARIBAS FINANCIAL MARKETS,BUY,,,Block-Deals-03-11-2024-to-03-11-2025.csv
2025-06-13,JUBLFOOD,CANARA HSBC LIFE INSURANCE COMPANY LIMITED,BUY,,,Block-Deals-03-11-2024-to-03-11-2025.csv
2025-06-13,JUBLFOOD,GHISALLO MASTER FUND LP,BUY,,,Block-Deals-03-11-2024-to-03-11-2025.csv
2025-06-13,JUBLFOOD,GRANDEUR PEAK GLOBAL TRUST GRANDEUR PEAK GLOBAL STALWARTS FUND,BUY,,,Block-Deals-03-11-2024-to-03-11-2025.csv
2025-06-13,JUBLFOOD,GRANDEUR PEAK GLOBAL TRUST GRANDEUR PEAK INTERNATIONAL STALWARTS FUND,BUY,,,Block-Deals-03-11-2024-to-03-11-2025.csv
2025-06-13,JUBLFOOD,GRANDEUR PEAK INTERNATIONAL STALWARTS L.P.,BUY,,,Block-Deals-03-11-2024-to-03-11-2025.csv
2025-06-13,JUBLFOOD,HSBC MUTUAL FUND,BUY,,,Block-Deals-03-11-2024-to-03-11-2025.csv
2025-06-13,JUBLFOOD,ICICI PRUDENTIAL LIFE INSURANCE COMPANY LIMITED,BUY,,,Block-Deals-03-11-2024-to-03-11-2025.csv
2025-06-13,JUBLFOOD,INVESCO MUTUAL FUND,BUY,,,Block-Deals-03-11-2024-to-03-11-2025.csv
2025-06-13,JUBLFOOD,JUBILANT CONSUMER PRIVATE LIMITED,SELL,,,Block-Deals-03-11-2024-to-03-11-2025.csv
2025-06-13,JUBLFOOD,KOTAK FUNDS - INDIA MIDCAP FUND,BUY,,,Block-Deals-03-11-2024-to-03-11-2025.csv
2025-06-13,JUBLFOOD,KOTAK MAHINDRA MUTUAL FUND,BUY,,,Block-Deals-03-11-2024-to-03-11-2025.csv
2025-06-13,JUBLFOOD,MIRAE ASSET MUTUAL FUND,BUY,,,Block-Deals-03-11-2024-to-03-11-2025.csv
2025-06-13,JUBLFOOD,MORGAN STANLEY ASIA SINGAPORE PTE,BUY,,,Block-Deals-03-11-2024-to-03-11-2025.csv
2025-06-13,JUBLFOOD,SOCIETE GENERALE,BUY,,,Block-Deals-03-11-2024-to-03-11-2025.csv
2025-06-13,JUBLFOOD,TEACHERS RETIREMENT SYSTEM OF THE STATE OF ILLINOIS,BUY,,,Block-Deals-03-11-2024-to-03-11-2025.csv
2025-06-13,JUBLFOOD,UTI MUTUAL FUND,BUY,,,Block-Deals-03-11-2024-to-03-11-2025.csv
2025-06-13,JUBLINGREA,AXIS MUTUAL FUND,BUY,,,Block-Deals-03-11-2024-to-03-11-2025.csv
2025-06-13,JUBLINGREA,BANDHAN MUTUAL FUND,BUY,,,Block-Deals-03-11-2024-to-03-11-2025.csv
2025-06-13,JUBLINGREA,HDFC MUTUAL FUND,BUY,,,Block-Deals-03-11-2024-to-03-11-2025.csv
2025-06-13,JUBLINGREA,ICICI PRUDENTIAL LIFE INSURANCE COMPANY LIMITED,BUY,,,Block-Deals-03-11-2024-to-03-11-2025.csv
2025-06-13,JUBLINGREA,JUBILANT ENPRO PRIVATE LIMITED,SELL,,,Block-Deals-03-11-2024-to-03-11-2025.csv
2025-06-13,JUBLINGREA,KOTAK MAHINDRA MUTUAL FUND,BUY,,,Block-Deals-03-11-2024-to-03-11-2025.csv
2025-06-13,JUBLINGREA,MORGAN STANLEY ASIA SINGAPORE PTE,BUY,,,Block-Deals-03-11-2024-to-03-11-2025.csv
2025-06-13,JUBLINGREA,NIKITA RESOURCES PRIVATE LIMITED,SELL,,,Block-Deals-03-11-2024-to-03-11-2025.csv
2025-06-13,JUBLINGREA,SHYAM SUNDER BHARTIA FAMILY TRUST,SELL,,,Block-Deals-03-11-2024-to-03-11-2025.csv
2025-06-13,JUBLINGREA,SOCIETE GENERALE,BUY,,,Block-Deals-03-11-2024-to-03-11-2025.csv
2025-06-13,SHALBY,FIRST WATER FUND,BUY,,,Block-Deals-03-11-2024-to-03-11-2025.csv
2025-06-13,SHALBY,HARESH TIKAMDAS KASWANI,SELL,,,Block-Deals-03-11-2024-to-03-11-2025.csv
2025-06-16,ASIANPAINT,ICICI PRUDENTIAL MUTUAL FUND,BUY,,,Block-Deals-03-11-2024-to-03-11-2025.csv
2025-06-16,ASIANPAINT,SIDDHANT COMMERCIALS PRIVATE LIMITED,SELL,,,Block-Deals-03-11-2024-to-03-11-2025.csv
2025-06-16,SOLARA,PRONOMZ VENTURES LLP,BUY,,,Block-Deals-03-11-2024-to-03-11-2025.csv
2025-06-16,SOLARA,SPIRACCA VENTURES LLP,SELL,,,Block-Deals-03-11-2024-to-03-11-2025.csv
2025-06-17,TVSSCS,AUTHUM INVESTMENT & INFRASTRUCTURE LIMITED,SELL,,,Block-Deals-03-11-2024-to-03-11-2025.csv
2025-06-17,TVSSCS,TVS MOTOR COMPANY LIMITED,BUY,,,Block-Deals-03-11-2024-to-03-11-2025.csv
2025-06-17,ZYDUSWELL,PPFAS MUTUAL FUND,BUY,,,Block-Deals-03-11-2024-to-03-11-2025.csv
2025-06-17,ZYDUSWELL,THREPSI CARE LLP,SELL,,,Block-Deals-03-11-2024-to-03-11-2025.csv
2025-06-18,BAJAJ-AUTO,BACHHRAJ & CO PRIVATE LIMITED,BUY,,,Block-Deals-03-11-2024-to-03-11-2025.csv
2025-06-18,BAJAJ-AUTO,SIDDHANT FAMILY TRUST,SELL,,,Block-Deals-03-11-2024-to-03-11-2025.csv
2025-06-24,AVALON,ALCHEMY EMERGING LEADERS OF TOMORROW,BUY,,,Block-Deals-03-11-2024-to-03-11-2025.csv
2025-06-24,AVALON,ALCHEMY INDIA LONG TERM FUND,BUY,,,Block-Deals-03-11-2024-to-03-11-2025.csv
2025-06-24,AVALON,ALCHEMY LEADERS OF TOMORROW,BUY,,,Block-Deals-03-11-2024-to-03-11-2025.csv
2025-06-24,AVALON,BHASKAR SRINIVASAN,SELL,,,Block-Deals-03-11-2024-to-03-11-2025.csv
2025-06-24,AVALON,ITI MUTUAL FUND,BUY,,,Block-Deals-03-11-2024-to-03-11-2025.csv
2025-06-24,AVALON,ITI MUTUAL FUND,BUY,,,Block-Deals-03-11-2024-to-03-11-2025.csv
2025-06-24,QUICKHEAL,ANUPAMA KAILASH KATKAR,SELL,,,Block-Deals-03-11-2024-to-03-11-2025.csv
2025-06-24,QUICKHEAL,SNEHA KAILASH KATKAR,BUY,,,Block-Deals-03-11-2024-to-03-11-2025.csv
2025-06-26,DELHIVERY,ASK ABSOLUTE RETURN FUND,BUY,,,Block-Deals-03-11-2024-to-03-11-2025.csv
2025-06-26,DELHIVERY,AXIS MUTUAL FUND,BUY,,,Block-Deals-03-11-2024-to-03-11-2025.csv
2025-06-26,DELHIVERY,CITIGROUP GLOBAL MARKETS SINGAPORE PTE LIMITED,BUY,,,Block-Deals-03-11-2024-to-03-11-2025.csv
2025-06-26,DELHIVERY,HDFC MUTUAL FUND,BUY,,,Block-Deals-03-11-2024-to-03-11-2025.csv
2025-06-26,DELHIVERY,HILL FORT INDIA FUND LP,BUY,,,Block-Deals-03-11-2024-to-03-11-2025.csv
2025-06-26,DELHIVERY,MORGAN STANLEY ASIA SINGAPORE PTE,BUY,,,Block-Deals-03-11-2024-to-03-11-2025.csv
2025-06-26,DELHIVERY,MORGAN STANLEY ASIA SINGAPORE PTE,BUY,,,Block-Deals-03-11-2024-to-03-11-2025.csv
2025-06-26,DELHIVERY,NEXUS OPPORTUNITY FUND LTD,SELL,,,Block-Deals-03-11-2024-to-03-11-2025.csv
2025-06-26,DELHIVERY,NEXUS VENTURES III LIMITED,SELL,,,Block-Deals-03-11-2024-to-03-11-2025.csv
2025-06-26,DELHIVERY,TATA EQUITY PLUS ABSOLUTE RETURNS FUND,BUY,,,Block-Deals-03-11-2024-to-03-11-2025.csv
2025-06-26,DELHIVERY,TATA MUTUAL FUND,BUY,,,Block-Deals-03-11-2024-to-03-11-2025.csv
2025-06-26,DELHIVERY,VIRIDIAN ASIA OPPORTUNITIES MASTER FUND,BUY,,,Block-Deals-03-11-2024-to-03-11-2025.csv
2025-06-26,POLICYBZR,ALOK  BANSAL,SELL,,,Block-Deals-03-11-2024-to-03-11-2025.csv
2025-06-26,POLICYBZR,CITIGROUP GLOBAL MARKETS MAURITIUS PRIVATE LIMITED,BUY,,,Block-Deals-03-11-2024-to-03-11-2025.csv
2025-06-26,POLICYBZR,EDELWEISS LIFE INSURANCE COMPANY LIMITED,BUY,,,Block-Deals-03-11-2024-to-03-11-2025.csv
2025-06-26,POLICYBZR,GHISALLO MASTER FUND LP,BUY,,,Block-Deals-03-11-2024-to-03-11-2025.csv
2025-06-26,POLICYBZR,GOLDMAN SACHS (SINGAPORE) PTE,BUY,,,Block-Deals-03-11-2024-to-03-11-2025.csv
2025-06-26,POLICYBZR,GOLDMAN SACHS INVESTMENTS MAURITIUS I LIMITED,BUY,,,Block-Deals-03-11-2024-to-03-11-2025.csv
2025-06-26,POLICYBZR,HDFC LIFE INSURANCE COMPANY LIMITED,BUY,,,Block-Deals-03-11-2024-to-03-11-2025.csv
2025-06-26,POLICYBZR,ICICI PRUDENTIAL LIFE INSURANCE COMPANY LIMITED,BUY,,,Block-Deals-03-11-2024-to-03-11-2025.csv
2025-06-26,POLICYBZR,MORGAN STANLEY ASIA SINGAPORE PTE,BUY,,,Block-Deals-03-11-2024-to-03-11-2025.csv
2025-06-26,POLICYBZR,MORGAN STANLEY ASIA SINGAPORE PTE,BUY,,,Block-Deals-03-11-2024-to-03-11-2025.csv
